node,timestamp,split,query,summary
28,1662479567.0,"['rig', 'fraud', 'say', 'believ']","[[""corps"", 0.8882947269416941], [""lectern"", 0.4592738595735461]]","Can't believe they just left Boris Johnson's corpse laying there. Can't believe Sky News spent time discussing the new design of lectern, that Truss should've made her speech at. WHO FUCKING CARES!!!"
28,1662479591.0,"['polici', 'cooper', 'administr', 'address', 'climat', 'plan', 'immigr', 'execut', 'day']","[[""metaphor"", 0.7069951230074115], [""thunderstorm"", 0.4804154736061984], [""insert"", 0.39404593178971387], [""femal"", 0.3377671866884693]]","Not sure this is the best metaphor to go for on day one of the job.. Also, why did she need a new podium in the first place?. Thunderstorm hits Downing Street ahead of Liz Truss’s first address to the nation as prime minister. Insert your own metaphor here…. 🌩."
28,1662479655.0,"['foreign', 'econom', 'brief', 'advis', 'nation', 'former', 'secur', 'domest', 'chief']","[[""thunderstorm"", 0.6513966469297517], [""insert"", 0.5365225247430414], [""metaphor"", 0.536494164751145]]",Thunderstorm hits Downing Street ahead of Liz Truss’s first address to the nation as prime minister. Insert your own metaphor here…. 🌩.
28,1662479676.0,"['sign', 'fund', 'govern', 'send', 'bill', 'pass']","[[""sign"", 1.0]]","The way its raining heavily and liz truss is about to make her speech, this is literally a sign. It's pissing down for truss..a sign of things to come. If that's not a sign of how this is going to go, then I don't know what is.."
28,1662479790.0,"['lead', 'state', 'process', 'ballot', 'recount', 'winner', 'machin', 'race']","[[""femal"", 0.7744172760513545], [""fun"", 0.6326751793402362]]","FUN FACT: With Liz Truss as its new PM, England is now one of 4 countries to have had 3 female Prime Ministers. NOT FUN FACT: The United States is now one of only 6 countries to have NEVER had a female leader elected. We MUST address that."
28,1662479817.0,"['member', 'remov', 'leav', 'resign']","[[""remov"", 0.7188147834897859], [""rain"", 0.49158178721171725], [""lectern"", 0.49158178721171725]]","They've removed the lectern, and there's speculation Truss won't talk outside, now. If rain stops our new Prime Minister from talking, what chance do we have?. The rain is god's tears at Boris Johnson's removal from power 🥺."
29,1662480478.0,"['rig', 'fraud', 'say', 'believ']","[[""lectern"", 1.0]]","Can't believe Sky News spent time discussing the new design of lectern, that Truss should've made her speech at. WHO FUCKING CARES!!!"
29,1662480701.0,"['foreign', 'econom', 'brief', 'advis', 'nation', 'former', 'secur', 'domest', 'chief']","[[""aspir"", 1.0]]","Lizz truss referring britain as an aspiration nation has made my day. I don't want an ""aspiration nation"" - I want people to be able to achieve their aspirations, not just have them. #truss. Britain being an aspiration nation is historically not a great thing."
29,1662480702.0,"['money', 'tax']","[[""cut"", 0.5775628765370019], [""boost"", 0.36778529079302996], [""evid"", 0.3496200010844549], [""work"", 0.34951275450467884], [""invest"", 0.3282538405687134], [""set"", 0.3123909056564713], [""start"", 0.28534738656218206]]","“I will cut taxes to reward hard work”. *People on the lowest incomes work just as hard as everyone else*, yet they won’t significantly benefit from Truss’s tax cut plans. This would have been the ideal opportunity to raise the minimum wage to lift more people out of poverty.."
29,1662480724.0,"['troop', 'pay', 'cut', 'servic', 'order']","[[""boost"", 0.47876990620524124], [""nh"", 0.447805952344947], [""start"", 0.4103105014792383], [""set"", 0.27574194508826577], [""work"", 0.26961723047358516], [""evid"", 0.2590356116322024], [""invest"", 0.2325342628304182], [""cut"", 0.21733413322161274], [""tribut"", 0.21007465946813572], [""fail"", 0.20156960977689836]]","Truss is going to fund massive tax cuts for the rich and big business through more borrowing. That is very irresponsible. For once, we need a government on the side of workers, pushing employers to boost pay, rather than attacking the unions supporting their members.."
29,1662480819.0,"['charg', 'pro-trump', 'assault', 'arrest', 'riot', 'mob', 'rioter', 'support', 'polic', 'capitol', 'protest']","[[""deepen"", 0.5340394331140359], [""congratul"", 0.44993294961991975], [""cooper"", 0.4394984401307509], [""relationship"", 0.4089757639299775], [""special"", 0.38979760179622225]]","◊Congratulations to Prime Minister Liz Truss. I look forward to deepening the special relationship between our countries and working in close cooperation on global challenges, including continued support for Ukraine as it defends itself against Russian aggression."
29,1662480819.0,"['alli', 'legal', 'court', 'overturn', 'challeng', 'lawsuit', 'result', 'ask']","[[""congratul"", 0.6648985229488762], [""deepen"", 0.4493812129414489], [""cooper"", 0.3698272634291746], [""relationship"", 0.33407611972219164], [""special"", 0.3280052150370886]]","Congratulations to Prime Minister Liz Truss. I look forward to deepening the special relationship between our countries and working in close cooperation on global challenges, including continued support for Ukraine as it defends itself against Russian aggression."
29,1662480825.0,"['lead', 'state', 'process', 'ballot', 'recount', 'winner', 'machin', 'race']","[[""lead"", 0.7111939071318077], [""conduct"", 0.7029958936285428]]","🟡 2015-""Now! A Tory Majority with only 1 Scottish seat will lead to independence."" 🟡 2016-""Now! Brexit will lead to independence."" 🟡 2019-""Now! Boris will lead to independence."" 🟡 2022-""Now! Liz Truss will lead to independence."" Sorry to break it to you but it didn't. It won't."
29,1662480843.0,"['polici', 'cooper', 'administr', 'address', 'climat', 'plan', 'immigr', 'execut', 'day']","[[""special"", 0.6425250816613644], [""deepen"", 0.4493172098405947], [""congratul"", 0.3704484313851324], [""cooper"", 0.3681941895359377], [""relationship"", 0.3353752567697696]]","◊Congratulations to Prime Minister Liz Truss. I look forward to deepening the special relationship between our countries and working in close cooperation on global challenges, including continued support for Ukraine as it defends itself against Russian aggression."
29,1662480843.0,"['russian', 'media', 'disinform', 'lie']","[[""deepen"", 0.5004259680216084], [""congratul"", 0.42161330773918126], [""cooper"", 0.41183556626885626], [""relationship"", 0.3735233902548471], [""aggress"", 0.37213212176962], [""special"", 0.35242800187079215]]","Congratulations to Prime Minister Liz Truss. I look forward to deepening the special relationship between our countries and working in close cooperation on global challenges, including continued support for Ukraine as it defends itself against Russian aggression."
29,1662480891.0,"['work', 'want', 'countri', 'congratul', 'peac', 'get', 'need', 'mani']","[[""deepen"", 1.0]]","Congratulations to Prime Minister Liz Truss. I look forward to deepening the special relationship between our countries and working in close cooperation on global challenges, including continued support for Ukraine as it defends itself against Russian aggression."
29,1662480891.0,['*'],"[[""consequenti"", 1.0]]","Ms Truss is right, Mr Johnson is a hugely consequential prime minister. Consequential in that as a consequence of his ineptitude you got stuck with me.. Did Truss describe Johnson as consequential or as having cünt credentials?"
29,1662480986.0,"['press', 'confer', 'hold']","[[""britain"", 1.0]]","Hold on, aren't we already a post-Brexit, Global Britain, aspiration nation?. In 1st speech as Britain's new PM, Liz Truss says 'now is the time to tackle the issues holding Britain back.' The main thing holding Britain back is the Tory party...."
29,1662481236.0,"['final', 'second', 'debat']","[[""intens"", 0.6114678232126877], [""unpopular"", 0.48407004892026445], [""plan"", 0.4484642674008559], [""second"", 0.43664984802297113]]","The Truss plan is tax cuts, fracking and more GP appointments. The first won’t work to deliver the growth she wants. The second is intensely unpopular and without giving the NHS a lot more money the third is not going to happen. This is a plan to fail."
29,1662481268.0,"['turnout', 'counti', 'find', 'poll', 'major', 'vote', 'overrid']","[[""plug"", 1.0]]","General Election Now. 80000 voted for Liz Truss. That is less than 0.1% of the voting population. Liz Truss is in ERG. Please plug the petition. The Boris succession starts tomorrow, and from what I've heard she intends to be tough..."
30,1662481455.0,"['term', 'next', 'presid', 'end']","[[""congratul"", 0.6320298155423705], [""term"", 0.6178091974109455], [""biden"", 0.3341921110522625], [""presid"", 0.3273617888061353]]",Is Truss having a laugh? Borrow money for a short term use and than pay it back over 10-20 years with interest. You borrow money long-term for long term projects like mortgages not short term consumption. That's like maxxing out on the credit cards!
30,1662481848.0,"['troop', 'pay', 'cut', 'servic', 'order']","[[""speech"", 0.7773935765473022], [""prime"", 0.377672978619216], [""minist"", 0.3568434437220531], [""consequenti"", 0.3545209514774394]]","“I am honoured to take on this responsibility at a vital time for our country”. Prime Minister Liz Truss pays tribute to her predecessor Boris Johnson, saying “history will see him as a hugely consequential prime minister”.."
30,1662481953.0,"['polici', 'cooper', 'administr', 'address', 'climat', 'plan', 'immigr', 'execut', 'day']","[[""hook"", 1.0]]","UK Taxpayers on the Hook for Truss’s £200 Billion Energy Plan.. Markets: RT Bloomberg UK: NEW: UK taxpayers will be on the hook for as much as £200 billion to cover the cost of Prime Minister Liz Truss’s plans to contain energy prices, sources familiar with the policy say."
30,1662482083.0,"['alli', 'legal', 'court', 'overturn', 'challeng', 'lawsuit', 'result', 'ask']","[[""monbiot"", 1.0]]","Now! didn't ask George Monbiot about Truss' foreign policy. When it comes to the catastrophic Ukraine and Syria proxy wars, Monbiot shares Truss's neocon extremism.."
30,1662482186.0,"['counsel', 'attorney', 'said', 'investig', 'gener']","[[""speech"", 1.0]]",I hope it's not lost on many that Liz Truss is using her speech to promise to fix and rebuild what her own party have broken and destroyed over the last 12 years. General Election Now. Eight things Boris Johnson said in his speech – and what he meant.
30,1662482317.0,"['sign', 'fund', 'govern', 'send', 'bill', 'pass']","[[""speech"", 1.0]]","Truss there with an expirational speech. Short, but I nearly passed out twice. Liz Truss has pledged to take action on energy bills in her first speech as Prime Minister.. Liz Truss vows to take action against rising fuel bills this week during first speech as Prime Minister.."
31,1662482368.0,"['health', 'team', 'educ', 'pick', 'president-elect', 'introduc']","[[""overburden"", 1.0]]","British Prime Minister Liz Truss, in her first speech as the leader of the country, said she would focus on tackling Britain’s energy crisis, struggling economy and overburdened health service.."
31,1662482549.0,"['demand', 'packag', 'stimulu', 'check', 'increas', 'relief']","[[""enough"", 0.5072719046385151], [""pay"", 0.4534439375235882], [""favour"", 0.3714474950942345], [""wage"", 0.3690020045364911], [""prove"", 0.3673108369854307], [""commit"", 0.3577860231435123]]","Liz Truss has committed to a Britain with “high-paying jobs.”. Ok then, prove it:. Come out in favour of inflation-level pay rises, increase the minimum wage – and give a deal to the @RMTunion. Enough Is Enough."
31,1662482666.0,"['call', 'democrat', 'governor', 'pressur', 'leader']","[[""overburden"", 0.7480641142459753], [""congratul"", 0.6636264619327534]]","British Prime Minister Liz Truss, in her first speech as the leader of the country, said she would focus on tackling Britain’s energy crisis, struggling economy and overburdened health service.."
31,1662482857.0,"['attempt', 'democraci', 'power', 'tri', 'coup', 'cheat']","[[""behold"", 1.0]]",The BBC trying to do an in-depth assessment of the first speech by Liz Truss is a thing to behold. They're struggling because she said fuck all.
32,1662483329.0,"['money', 'tax']","[[""fix"", 1.0]]","Truss promises energy fix, tax cuts and action on NHS. Truss promises energy fix, tax cuts and action on NHS."
33,1662486701.0,"['destroy', 'clemenc', 'trump', 'peopl', 'enemi', 'american']","[[""glasgow"", 1.0]]",📺 People make Glasgow.. 🔥 The people of Glasgow say it how it is.... 🏴󠁧󠁢󠁳󠁣󠁴󠁿 We asked people in Glasgow for their thoughts about Liz Truss becoming Prime Minister....
33,1662487031.0,"['charg', 'pro-trump', 'assault', 'arrest', 'riot', 'mob', 'rioter', 'support', 'polic', 'capitol', 'protest']","[[""eustic"", 0.6513389558282463], [""cabinet"", 0.5872848303409788], [""shapp"", 0.4804727803652748]]","Liz Truss clears out Sunak supporters in cabinet reshuffle. If they're all as dim as Truss, that will be some Cabinet? Big clear out of all the Sunak supporters from cabinet - the former chancellor himself, Dominic Raab, Grant Shapps, George Eustice. A unity cabinet this is not."
33,1662487181.0,"['foreign', 'econom', 'brief', 'advis', 'nation', 'former', 'secur', 'domest', 'chief']","[[""cabinet"", 0.5516161967612649], [""deloitt"", 0.37887741454623036], [""eustic"", 0.3695554895009206], [""shapp"", 0.3093203653590857], [""sinclair"", 0.3051479712705224], [""director"", 0.2831483801416244], [""raab"", 0.27115267898840084], [""public"", 0.2703868767180279]]","Big clear out of all the Sunak supporters from cabinet - the former chancellor himself, Dominic Raab, Grant Shapps, George Eustice. A unity cabinet this is not. Looking into the ideas of Truss's new economic advisor, Matthew Sinclair, and there's a lot of this sort of thing."
33,1662487456.0,"['health', 'team', 'educ', 'pick', 'president-elect', 'introduc']","[[""theres"", 0.5964050979953568], [""deputi"", 0.5912449033268128], [""coffey"", 0.5428908024411693]]","Deputy PM! Hadn’t heard that doing the rounds. Wonder how intentional the prestige boost to the health brief was, given Coffey is a good friend/ally of Truss.. Therese Coffey has been appointed as health secretary and deputy PM in the new Truss cabinet."
34,1662487639.0,"['destroy', 'clemenc', 'trump', 'peopl', 'enemi', 'american']","[[""continu"", 1.0]]","In aligning herself closely with Johnson Truss makes herself the Continuity PM. Continuity populism. Continuity lying. Continuity gaslighting. Continuity undermining institutions, standards and rule of law. Continuity over promotion of second rate people. She has rejected change."
34,1662487668.0,"['money', 'tax']","[[""deloitt"", 0.6697103537409413], [""sinclair"", 0.5679457624293198], [""director"", 0.47846175712460204]]","Liz Truss appoints Matthew Sinclair, a director at Deloitte and former head of the TaxPayers' Alliance as chief economic adviser. Expect decimation of public services, tax cuts for the rich, low public sector wages. deeper poverty and inequalities. Recession and unrest looms."
34,1662487821.0,"['retir', 'receiv', 'confirm', 'nomin', 'secretari', 'first']","[[""deputi"", 0.6333325506830302], [""theres"", 0.5642528900463161], [""coffey"", 0.5296305847661243]]",Therese Coffey - a loyal ally of Liz Truss - has been appointed deputy prime minister and health secretary. Therese Coffey has been appointed as health secretary and deputy PM in the new Truss cabinet. Liz Truss makes close ally Coffey first female deputy prime minister.
34,1662488151.0,"['troop', 'pay', 'cut', 'servic', 'order']","[[""deloitt"", 0.48930526394054513], [""pubic"", 0.48930526394054513], [""told"", 0.47620534806155834], [""sinclair"", 0.4149537925419165], [""director"", 0.34957479012765935]]","I’ve just told Truss the same things I told Johnson when he took the job: Work hard, follow the rules, treat people with respect and never lie to the pubic. I just hope she was paying more attention than he did…."
34,1662488450.0,"['foreign', 'econom', 'brief', 'advis', 'nation', 'former', 'secur', 'domest', 'chief']","[[""secretari"", 0.7557498523800474], [""sec"", 0.46954168580389943], [""cleverli"", 0.4564786587782268]]","Liz Truss reshuffle live: James Cleverly made foreign secretary as Kwarteng is chancellor and Coffey health secretary. Truss awards James Cleverly the Foreign secretary role. The first time Truss, Foreign secretary and Cleverly have been used in the same sentence. Liz Truss."
35,1662488787.0,"['destroy', 'clemenc', 'trump', 'peopl', 'enemi', 'american']","[[""told"", 0.7134417064308883], [""pubic"", 0.7007145863509494]]","I’ve just told Truss the same things I told Johnson when he took the job: Work hard, follow the rules, treat people with respect and never lie to the pubic. I just hope she was paying more attention than he did…."
35,1662488866.0,"['work', 'want', 'countri', 'congratul', 'peac', 'get', 'need', 'mani']","[[""pubic"", 0.49519641965720007], [""told"", 0.4658738439160133], [""follow"", 0.43722129770232077], [""resign"", 0.42011367908053543], [""appoint"", 0.41241253739250466]]","I’ve just told Truss the same things I told Johnson when he took the job: Work hard, follow the rules, treat people with respect and never lie to the pubic. I just hope she was paying more attention than he did…."
35,1662489060.0,"['counsel', 'attorney', 'said', 'investig', 'gener']","[[""sec"", 1.0]]","Therese Coffey (Heath Deputy PM), James Cleverly (Foreign Sec), Kwasi Kwarteng (Chancellor) and Suella Braverman (Home Sec) taking the top four posts in Truss’ cabinet. As we face the biggest cost of living crisis in a generation. Help."
35,1662489395.0,"['troop', 'pay', 'cut', 'servic', 'order']","[[""attent"", 1.0]]","If you think Liz Truss is the answer, then you’re really rich and/or haven’t been paying attention for the last 12 years. I doubt she was paying attention. But she will work hard for her friends to become richer :)."
36,1662490082.0,"['lead', 'state', 'process', 'ballot', 'recount', 'winner', 'machin', 'race']","[[""heaton"", 0.5170358243927311], [""ni"", 0.4658552062447777], [""crypto"", 0.4338750096651668], [""uncertain"", 0.4068295251689949], [""hub"", 0.4023618974853187]]",Britain’s prospects as a crypto hub remain uncertain after Liz Truss won the race to be the country’s new prime minister. U.K.'s crypto future in limbo as Truss wins prime minister race by AmerBanker 2022-09-06 18:37:15.
37,1662491236.0,"['lead', 'state', 'process', 'ballot', 'recount', 'winner', 'machin', 'race']","[[""sunakit"", 0.41635719598320353], [""process"", 0.4089788734616145], [""offici"", 0.39193261160837434], [""queen"", 0.38665759240567527], [""form"", 0.38169186905340236], [""behold"", 0.3257891826924403], [""cull"", 0.32317244026536496]]","New prime minister Liz Truss has started the process of appointing her cabinet after being officially asked by the Queen to form a new government.. *Liz Truss' Cabinet Selection Process* ""Do you hate something?"" ""Yes."" ""You're the Minister for it!"" ""Thank you."" ""Pork Market."""
37,1662491622.0,"['alli', 'legal', 'court', 'overturn', 'challeng', 'lawsuit', 'result', 'ask']","[[""sunakit"", 0.4374512506870178], [""process"", 0.4374512506870178], [""offici"", 0.3900691902047401], [""queen"", 0.34873905580500714], [""cull"", 0.342489361241442], [""behold"", 0.34229475749197497], [""form"", 0.33020484669961647]]",Liz Truss becomes UK prime minister after Queen asks her to form a government. New prime minister Liz Truss has started the process of appointing her cabinet after being officially asked by the Queen to form a new government..
38,1662493009.0,"['turnout', 'counti', 'find', 'poll', 'major', 'vote', 'overrid']","[[""prioriti"", 0.6981312166747735], [""amongst"", 0.5090613502063958], [""vast"", 0.5034573924675669]]","Liz Truss today said tax cuts were amongst her ""first priority"": cuts that she knows will massively benefit the rich and do almost nothing for the poor. That’s her priority even in this cost-of-living crisis. Truss is a Prime Minister for the wealthy few, not the vast majority."
38,1662493312.0,"['foreign', 'econom', 'brief', 'advis', 'nation', 'former', 'secur', 'domest', 'chief']","[[""ukrain"", 0.46721404965831065], [""invas"", 0.4143859608595032], [""illeg"", 0.4128704160002261], [""zelenski"", 0.2831196597101492], [""echr"", 0.23988749069853293], [""asap"", 0.2382755376069901], [""boat"", 0.237756386599598], [""volodymyr"", 0.22164386728373073], [""first"", 0.22162834955917357], [""channel"", 0.21318820605056446], [""small"", 0.21173782209499606]]",#Breaking Ukrainian President Volodymyr Zelensky said he has invited Liz Truss to Ukraine after becoming the first foreign leader to hold a call with the new Prime Minister.
38,1662493312.0,"['counsel', 'attorney', 'said', 'investig', 'gener']","[[""prioriti"", 0.6914790964779035], [""amongst"", 0.5136307485085954], [""vast"", 0.507976488944717]]","Liz Truss today said tax cuts were amongst her ""first priority"": cuts that she knows will massively benefit the rich and do almost nothing for the poor. That’s her priority even in this cost-of-living crisis. Truss is a Prime Minister for the wealthy few, not the vast majority."
38,1662493420.0,"['money', 'tax']","[[""prioriti"", 0.6528620062466505], [""amongst"", 0.5464245984136069], [""vast"", 0.5245868460494666]]","Liz Truss today said tax cuts were amongst her ""first priority"": cuts that she knows will massively benefit the rich and do almost nothing for the poor. That’s her priority even in this cost-of-living crisis. Truss is a Prime Minister for the wealthy few, not the vast majority."
38,1662493423.0,"['call', 'democrat', 'governor', 'pressur', 'leader']","[[""zelenski"", 1.0]]","Truss's first phone call: Zelensky. 🇺🇦 Ukraine's president, Volodymyr Zelensky, has confirmed that he was the 1st foreign leader to have a conversation with the new Prime Minister, Liz Truss.. Truss' first call to an overseas leader was to... Zelensky."
38,1662493464.0,"['troop', 'pay', 'cut', 'servic', 'order']","[[""prioriti"", 0.6578843650857009], [""vast"", 0.5350498629707846], [""amongst"", 0.5300092511557969]]","Liz Truss today said tax cuts were amongst her ""first priority"": cuts that she knows will massively benefit the rich and do almost nothing for the poor. That’s her priority even in this cost-of-living crisis. Truss is a Prime Minister for the wealthy few, not the vast majority."
39,1662495719.0,"['son', 'staff', 'posit', 'appoint']","[[""zelenski"", 1.0]]","Zelensky calls new British PM, invites her to Ukraine.. British Prime Minister Liz Truss' conversation with Ukrainian President Volodymyr Zelensky was her first call with a foreign leader since being appointed.."
40,1662497367.0,"['term', 'next', 'presid', 'end']","[[""biden"", 1.0]]",⚠️ UK PM TRUSS SPOKE WITH U.S. PRESIDENT BIDEN - DOWNING STREET. - Reuters via. The call between President Biden Liz Truss Truss is underway. Володимир Зеленський was the first one to talk to her. Downing Street readout of call between President Biden and new U.K. PM Truss.
40,1662497611.0,"['health', 'team', 'educ', 'pick', 'president-elect', 'introduc']","[[""malthous"", 0.6639447911147429], [""kit"", 0.5600041890519919], [""educ"", 0.49555284541189043]]",Kit Malthouse is announced as Education Secretary: Kit Malthouse has been announced as Education Secretary as a part of the new cabinet after Liz Truss was announced as the new Prime Minister.. Kit Malthouse is announced as Education Secretary was….
41,1662499724.0,"['charg', 'pro-trump', 'assault', 'arrest', 'riot', 'mob', 'rioter', 'support', 'polic', 'capitol', 'protest']","[[""sin"", 0.532925712116921], [""incit"", 0.5190568303441284], [""mob"", 0.4790507227679912], [""flaw"", 0.46591908874100074]]","Here, truss and yer shitty mob. I'll note that Boris Johnson, for all his sins and flaws, did not incite a mob to attack Downing Street today. He just... left."
