node,timestamp,split,query,summary
13,1662455067.0,"['transit', 'lose', 'lost', 'conced', 'acknowledg']","[[""bhatia"", 0.6253205581050871], [""taru"", 0.5518034974568131], [""scroll"", 0.5518034974568131]]","1) The level of hatred. Taru Bhatia, audience editor at Scroll. And, This is after Rishi Sunak lost the UK Prime Ministerial race.."
14,1662455332.0,"['destroy', 'clemenc', 'trump', 'peopl', 'enemi', 'american']","[[""money"", 1.0]]","Money tree showed up, from the people who said there's no money tree.... People complaining now that Liz Truss will freeze energy bills for 2 years. Where is the money coming from they say. She cant win."
14,1662455381.0,"['troop', 'pay', 'cut', 'servic', 'order']","[[""money"", 1.0]]","Liz Truss to freeze energy bills, likely at a cost of hundreds of billions of pounds. Where is this money coming from? The magic money tree otherwise known as 'crippling future taxes'. Why do people still think government money is free? We always end up paying."
14,1662455557.0,"['foreign', 'econom', 'brief', 'advis', 'nation', 'former', 'secur', 'domest', 'chief']","[[""clearout"", 0.46515119816644673], [""fvd"", 0.4645092934064532], [""unit"", 0.4497163043794126], [""offici"", 0.37369860886359735], [""deliveri"", 0.3399037643593807], [""loyal"", 0.33231837966988026]]","Revealed: Liz Truss's new Number 10 team. There's a big clearout this morning - the delivery unit is gone, there will be a new economic unit. Truss is putting her most loyal allies in key roles. It sounds pretty brutal - officials very upset as they're asked to leave."
14,1662455589.0,"['term', 'next', 'presid', 'end']","[[""money"", 1.0]]","Liz Truss to freeze energy bills, likely at a cost of hundreds of billions of pounds. Where is this money coming from? The magic money tree otherwise known as 'crippling future taxes'. Why do people still think government money is free? We always end up paying."
14,1662455828.0,"['alli', 'legal', 'court', 'overturn', 'challeng', 'lawsuit', 'result', 'ask']","[[""dcm"", 0.7144554645761167], [""impend"", 0.47258516523415295], [""secretari"", 0.3743928362136313], [""avert"", 0.3550304985911018]]",Nadine Dorries confirms Cabinet exit and says that Liz Truss asked her to stay on as Culture Secretary but she declined... Lots of newspapers asking if Liz Truss can avert the impending crisis but Liz Truss *is* the impending crisis.
14,1662456006.0,['*'],"[[""triumph"", 1.0]]",Don't tell filming it like the opening of Triumph Of The Will?. Truss in triumph.
14,1662456134.0,"['retir', 'receiv', 'confirm', 'nomin', 'secretari', 'first']","[[""secretari"", 1.0]]",Liz Truss’ career so far. Environment Secretary who cut funding to stop sewage discharge. Chief Secretary to the Treasury who closed our gas storage. Justice Secretary who cut the courts and access to justice. What could possibly go wrong now she’s Prime Minister?
15,1662456762.0,"['troop', 'pay', 'cut', 'servic', 'order']","[[""premier"", 0.7309635520075229], [""vow"", 0.6824165045165197]]",RT Xtra News: Liz Truss vows tax cuts after winning vote to be next British premier. Liz Truss vows tax cuts after winning vote to be next British prime minister. Liz Truss vows tax cuts after winning vote to be next British premier.
15,1662456839.0,"['foreign', 'econom', 'brief', 'advis', 'nation', 'former', 'secur', 'domest', 'chief']","[[""ceo"", 0.6110983688919845], [""advisor"", 0.5662960059005389], [""no10"", 0.5530529967721475]]","New No10 health adviser is currently DWP special advisor - which would strengthen 'Coffey will be new health sec' rumours. The chief economic advisor in Truss's No10 policy unit is a former CEO of the TaxPayers' Alliance – the radical, libertarian pressure group.."
15,1662457428.0,['*'],"[[""aberdeen"", 0.9381566197601935], [""circl"", 0.28142578863209194], [""left"", 0.20164742074455824]]",Liz Truss’ plane waiting to land at Aberdeen! She’s going round in circles and not even PM yet 😊. Liz Truss hasn’t hit the ground yet as promised (as Aberdeen is fogged out). What are the constitutional implications if Liz Truss just keeps circling Aberdeen airport forever..
16,1662457985.0,"['money', 'tax']","[[""reform"", 1.0]]",Johnson said today he had reformed social care.. His “reform” involved hiking taxes to a seventy year high - breaking a manifesto pledge not to raise taxes - and new Prime Minister Liz Truss now says she’s going to reverse it!. Utterly delusional.
16,1662458713.0,"['polici', 'cooper', 'administr', 'address', 'climat', 'plan', 'immigr', 'execut', 'day']","[[""meet"", 0.5487122776921624], [""got"", 0.5444684878663445], [""spare"", 0.48623487645795915], [""she"", 0.40748564017193145]]","Spare a thought for the Queen having to speak th Johnson and Truss on the same day. If you think you’re having a tough day spare a thought for the Queen. She’s got to have a meeting with Boris Johnson and, when that’s done, she’s got to have a meeting with Liz Truss too."
17,1662458944.0,"['destroy', 'clemenc', 'trump', 'peopl', 'enemi', 'american']","[[""handout"", 1.0]]","BREAKING: Liz Truss might be opposed to handouts, but Boris Johnson is entitled to a Public Duty Cost Allowance of £115,000 a year, simply because he was prime minister before he resigned in disgrace. I'm pretty sure they only hate handouts for poor people x."
17,1662459213.0,"['call', 'democrat', 'governor', 'pressur', 'leader']","[[""thwart"", 1.0]]",Ukraine leader hopes Liz Truss will help ‘thwart’ Russia.
18,1662460073.0,"['foreign', 'econom', 'brief', 'advis', 'nation', 'former', 'secur', 'domest', 'chief']","[[""advisor"", 0.8074005026098162], [""stare"", 0.35500862472968076], [""ceo"", 0.2833845862484874], [""chief"", 0.2799907535358953], [""made"", 0.25173728163331727]]",Well let’s hope Liz Truss has the same Chief Advisor and party Organiser as Boris ie. Carrie Johnson. Truss has made a former CEO of the Taxpayer's Alliance her Chief Economic Advisor.. *stares at everyone*
18,1662460687.0,"['rig', 'fraud', 'say', 'believ']","[[""unless"", 0.9472769039047856], [""handout"", 0.3204160846907716]]","Unless Boris Johnson comes out and issues a profuse apology for leaving Britain in such a shameful shambles, why do we give a monkey’s cuss what he has to say this morning? No 10. Liz Truss doesn’t believe in handouts unless your name is Shell, BP or British Gas."
19,1662461480.0,"['attempt', 'democraci', 'power', 'tri', 'coup', 'cheat']","[[""eight"", 0.766040090427734], [""achiev"", 0.6427927969862989]]",UK wind power given huge boost after Boris Johnson gives eight-minute speech about his own achievements.
19,1662461622.0,"['call', 'democrat', 'governor', 'pressur', 'leader']","[[""appoint"", 0.6647983885611443], [""publicli"", 0.5418003209534199], [""cabinet"", 0.5142912742612662]]","Liz Truss under pressure to appoint unity cabinet to bring together party - but allies against giving out jobs too widely. One cabinet minister: “It would mean appointing people who didn’t support her - people who very publicly said her ideas were shit and she’s incompetent."""
19,1662461681.0,"['alli', 'legal', 'court', 'overturn', 'challeng', 'lawsuit', 'result', 'ask']","[[""appoint"", 0.8149926034049833], [""publicli"", 0.5794713594261305]]","Liz Truss under pressure to appoint unity cabinet to bring together party - but allies against giving out jobs too widely. One cabinet minister: “It would mean appointing people who didn’t support her - people who very publicly said her ideas were shit and she’s incompetent."""
19,1662461768.0,"['counsel', 'attorney', 'said', 'investig', 'gener']","[[""uniti"", 0.9141810299173024], [""publicli"", 0.2878009174162436], [""appoint"", 0.28538338506946836]]",They are doing this after Sunak are first rate ch**tiyas if they still believe in some sort of general brown unity. White Unity is possible. Black Unity possible. Brown Unity for East Asian Unity probably.
19,1662462341.0,"['retir', 'receiv', 'confirm', 'nomin', 'secretari', 'first']","[[""palac"", 0.814268566129391], [""confirm"", 0.5804883308160342]]","Interesting to have it confirmed that the Conservatives have fewer than 180,000 members.. Confirmed: Liz Truss will be the next WEF representative in charge of administering their agenda in the UK. Confirmation from the Palace that Boris Johnson has resigned to the Queen 👇."
20,1662462629.0,"['rig', 'fraud', 'say', 'believ']","[[""buckingham"", 0.8966545219017318], [""palac"", 0.4427309209363819]]",Buckingham Palace says the Queen 'was graciously please to accept' Boris Johnson's resignation. Buckingham Palace say the Queen has accepted Boris Johnson's resignation as Prime Minister. Liz Truss is preparing to take over..
20,1662462691.0,"['hour', 'take', 'spent', 'time', 'year', 'last', 'offic']","[[""buckingham"", 0.9073614181163245], [""palac"", 0.4203513493661374]]",Buckingham Palace say the Queen has accepted Boris Johnson's resignation as Prime Minister. Liz Truss is preparing to take over.. Buckingham Palace confirms that The Queen has performed her first cartwheel in 75 years..
20,1662462748.0,['*'],"[[""gracious"", 1.0]]","""Graciously pleased to accept."" Damn Elizabeth Windsor 💀. ""Graciously pleased."" ouch baby, ouch. “Graciously pleased”. Over the fucking moon.. Graciously pleased🤣. We're all graciously pleased. 'Graciously pleased'. That's Royal-speak for 'fucking delighted, like the rest of us'.."
20,1662462874.0,"['work', 'want', 'countri', 'congratul', 'peac', 'get', 'need', 'mani']","[[""employ"", 0.5537143142796983], [""union"", 0.5347399338289531], [""boost"", 0.38662622959110576], [""push"", 0.38627427196069586], [""attack"", 0.19622370971392178], [""side"", 0.1877582637488505], [""rather"", 0.18710718020400496]]","For once, we need a government on the side of workers, pushing employers to boost pay, rather than attacking the unions supporting their members.."
20,1662462901.0,"['foreign', 'econom', 'brief', 'advis', 'nation', 'former', 'secur', 'domest', 'chief']","[[""brief"", 0.7422074799912114], [""bori"", 0.670170169915892]]","I also like the ""positive noises from the energy companies"" stuff included in the briefings. Yeah, no shit.. Trying my best to enjoy this brief period between Boris resigning and Liz Truss being appointed."
20,1662462903.0,"['troop', 'pay', 'cut', 'servic', 'order']","[[""boost"", 0.6679143326503694], [""push"", 0.6345450545889704], [""side"", 0.23054094757201435], [""employ"", 0.226125012865378], [""attack"", 0.21670571747446507]]","For once, we need a government on the side of workers, pushing employers to boost pay, rather than attacking the unions supporting their members.."
20,1662462957.0,"['charg', 'pro-trump', 'assault', 'arrest', 'riot', 'mob', 'rioter', 'support', 'polic', 'capitol', 'protest']","[[""employ"", 0.4249748396437842], [""side"", 0.4206573104965123], [""member"", 0.3726396702278858], [""boost"", 0.25761793678297684], [""aberdeen"", 0.25493680802666785], [""push"", 0.25000907995003724], [""attack"", 0.22583567916193723], [""separ"", 0.22357397528062806], [""journey"", 0.2121836725331827], [""union"", 0.20946601255481098], [""jet"", 0.20649263290808817], [""rather"", 0.19893228373102054], [""travel"", 0.19396111157929027]]","For once, we need a government on the side of workers, pushing employers to boost pay, rather than attacking the unions supporting their members.."
20,1662463065.0,"['term', 'next', 'presid', 'end']","[[""offici"", 0.7376657283627105], [""premiership"", 0.675166107857253]]","One disgusting Premiership ends, another is about to begin!. Liz Truss has now arrived at Balmoral where she will officially be made the UK's next prime minister. It’s official. The Boris Johnson premiership has ended.."
20,1662463265.0,"['retir', 'receiv', 'confirm', 'nomin', 'secretari', 'first']","[[""buckingham"", 1.0]]","BREAKING: Buckingham Palace has confirmed that the Queen is resigned to having Liz Truss as Prime Minister. As Buckingham Palace confirms Boris Johnson is no longer prime minister, some analysis of that speech outside No10 this morning...."
20,1662463321.0,"['sign', 'fund', 'govern', 'send', 'bill', 'pass']","[[""balmor"", 0.732856689202778], [""form"", 0.38891340373250777], [""arriv"", 0.37653416183367405], [""boost"", 0.35571043571282757], [""queen"", 0.20822955694411208]]","For once, we need a government on the side of workers, pushing employers to boost pay, rather than attacking the unions supporting their members.. Liz Truss has arrived at Balmoral to be invited by the Queen to form a government.."
21,1662463666.0,"['call', 'democrat', 'governor', 'pressur', 'leader']","[[""queen"", 0.7275299017602866], [""arriv"", 0.5621379582280154], [""balmor"", 0.3933206808240645]]","Boris Johnson has left Balmoral after tendering his resignation to the Queen. Party leader Liz Truss has now arrived for her meeting with the Queen, where she will be invited to form a new government.. They should call Liz Truss Hermes because when she delivers, nothing arrives."
21,1662463732.0,['*'],"[[""arriv"", 1.0]]","Liz Truss has now arrived at Windsor Castle to be sworn in as PM. off to a great start then. Liz truss has arrived at balmoral to meet the queen. Liz Truss, Britain’s 56th PM has arrived for her audience with the Queen.. Why has the pound fallen on Truss’s arrival? | ITV News."
21,1662463846.0,"['children', 'justic', 'famili', 'separ', 'border', 'pardon']","[[""journey"", 0.9252186841661123], [""aberdeen"", 0.37943429796201555]]",Here are the separate private jets that Liz Truss and her “friend” Boris Johnson used to travel from London to Aberdeen. Both journeys will be charged to UK taxpayers..
21,1662463884.0,"['death', 'viru', 'travel', 'vaccin']","[[""separ"", 0.7716678435802133], [""aberdeen"", 0.4830371334442334], [""journey"", 0.4137678901246942]]",Here are the separate private jets that Liz Truss and her “friend” Boris Johnson used to travel from London to Aberdeen. Both journeys will be charged to UK taxpayers..
21,1662463942.0,"['hour', 'take', 'spent', 'time', 'year', 'last', 'offic']","[[""floatplan"", 0.5323552655910676], [""nadal"", 0.5323552655910676], [""tiafo"", 0.5323552655910676], [""search"", 0.3870317992005201]]","Things to know today: Boris Johnson officially resigns, new PM to take over; search ends for 9 missing in floatplane crash; US's Tiafoe stuns Nadal.."
21,1662463966.0,"['alli', 'legal', 'court', 'overturn', 'challeng', 'lawsuit', 'result', 'ask']","[[""permiss"", 1.0]]",Liz Truss has arrived at Balmoral where she will ask The Queen for permission to form a government..
21,1662464010.0,"['term', 'next', 'presid', 'end']","[[""floatplan"", 0.5323552655910676], [""nadal"", 0.5323552655910676], [""tiafo"", 0.5323552655910676], [""search"", 0.3870317992005201]]","Things to know today: Boris Johnson officially resigns, new PM to take over; search ends for 9 missing in floatplane crash; US's Tiafoe stuns Nadal.."
21,1662464045.0,"['cabinet', 'nomine', 'invok', 'announc', 'week', 'new']","[[""floatplan"", 0.5323552655910676], [""nadal"", 0.5323552655910676], [""tiafo"", 0.5323552655910676], [""search"", 0.3870317992005201]]","Things to know today: Boris Johnson officially resigns, new PM to take over; search ends for 9 missing in floatplane crash; US's Tiafoe stuns Nadal.."
21,1662464070.0,"['popular', 'project', 'offici', 'affirm', 'win', 'certifi', 'elector', 'object', 'colleg']","[[""floatplan"", 0.5323552655910676], [""nadal"", 0.5323552655910676], [""tiafo"", 0.5323552655910676], [""search"", 0.3870317992005201]]","Things to know today: Boris Johnson officially resigns, new PM to take over; search ends for 9 missing in floatplane crash; US's Tiafoe stuns Nadal.."
21,1662464161.0,"['work', 'want', 'countri', 'congratul', 'peac', 'get', 'need', 'mani']","[[""balmor"", 1.0]]",It's not too much to hope that Truss will get lost in Balmoral. Imagine they get to Balmoral and they pin the queen’s death on Johnson and Truss.. Did Johnson and Truss REALLY need TWO jets to travel to the same destination? #Balmoral #environment.
21,1662464283.0,"['member', 'remov', 'leav', 'resign']","[[""floatplan"", 0.5773502691896258], [""nadal"", 0.5773502691896258], [""tiafo"", 0.5773502691896258]]","Things to know today: Boris Johnson officially resigns, new PM to take over; search ends for 9 missing in floatplane crash; US's Tiafoe stuns Nadal.."
21,1662464285.0,"['sign', 'fund', 'govern', 'send', 'bill', 'pass']","[[""balmor"", 1.0]]",Conservative Party leader Liz Truss has arrived at Balmoral for a meeting with the Queen where she will be invited to form a new government.. Liz Truss has arrived at Balmoral where she will ask The Queen for permission to form a government..
22,1662464892.0,"['call', 'democrat', 'governor', 'pressur', 'leader']","[[""newli"", 1.0]]",Newly-elected British Conservative party leader Liz Truss has officially become the UK prime minister after being formally invited by Queen Elizabeth to form a government..
22,1662464926.0,"['lead', 'state', 'process', 'ballot', 'recount', 'winner', 'machin', 'race']","[[""castl"", 0.6834082861178132], [""balmor"", 0.5407083202308972], [""queen"", 0.4904973260870997]]",Liz Truss has just met the Queen at Balmoral Castle as part of the formal process for her to become the UK's new prime minister. 📷: PA Media. Liz Truss meets the Queen at Balmoral Castle as part of the formal process for her to become the UK's next prime minister..
22,1662464981.0,"['term', 'next', 'presid', 'end']","[[""queen"", 0.8783722884022478], [""castl"", 0.4779771155264636]]",Boris Johnson's premiership comes to an end as Queen officially accepts resignation. Liz Truss meets the Queen at Balmoral Castle as part of the formal process for her to become the UK's next prime minister..
22,1662465432.0,"['evid', 'republican', 'outcom', 'claim', 'widespread', 'voter', 'proof', 'elect']","[[""newli"", 1.0]]",Boris Johnson handed over the position of British Prime Minister to the newly elected Liz Truss. Newly-elected British Conservative party leader Liz Truss has officially become the UK prime minister after being formally invited by Queen Elizabeth to form a government..
22,1662465537.0,"['foreign', 'econom', 'brief', 'advis', 'nation', 'former', 'secur', 'domest', 'chief']","[[""winter"", 0.876836382831496], [""windfal"", 0.48078889103532524]]","People are terrified of paying their bills this winter, but former Shell employee Liz Truss says a windfall tax on her old bosses “sends the wrong message”. Labour would freeze energy bills this winter, paid for through a windfall tax on the huge profits from oil and gas giants.."
23,1662465977.0,"['money', 'tax']","[[""winter"", 1.0]]","People are terrified of paying their bills this winter, but former Shell employee Liz Truss says a windfall tax on her old bosses “sends the wrong message”. Labour would freeze energy bills this winter, paid for through a windfall tax on the huge profits from oil and gas giants.."
23,1662466449.0,"['alli', 'legal', 'court', 'overturn', 'challeng', 'lawsuit', 'result', 'ask']","[[""majesti"", 1.0]]",🤝 The Queen received Liz Truss at Balmoral Castle today.. Her Majesty asked her to form a new Administration. Ms. Truss accepted Her Majesty's offer and was appointed Prime Minister and First Lord of the Treasury..
23,1662466449.0,"['retir', 'receiv', 'confirm', 'nomin', 'secretari', 'first']","[[""majesti"", 1.0]]",🤝 The Queen received Liz Truss at Balmoral Castle today.. Her Majesty asked her to form a new Administration. Ms. Truss accepted Her Majesty's offer and was appointed Prime Minister and First Lord of the Treasury..
23,1662466461.0,"['polici', 'cooper', 'administr', 'address', 'climat', 'plan', 'immigr', 'execut', 'day']","[[""majesti"", 1.0]]","The Picture of the day! Our Majesty meets our New Prime Minister! Lord, Let Truss listen to some advice from thw Queen. Because we have had enough of New prime ministers who let us down. 🇬🇧👀. Her Majesty The Queen on being told she had to see Boris Johnson and me on the same day:."
23,1662466547.0,"['cabinet', 'nomine', 'invok', 'announc', 'week', 'new']","[[""majesti"", 1.0]]",🤝 The Queen received Liz Truss at Balmoral Castle today.. Her Majesty asked her to form a new Administration. Ms. Truss accepted Her Majesty's offer and was appointed Prime Minister and First Lord of the Treasury..
24,1662466970.0,"['son', 'staff', 'posit', 'appoint']","[[""majesti"", 1.0]]",🤝 The Queen received Liz Truss at Balmoral Castle today.. Her Majesty asked her to form a new Administration. Ms. Truss accepted Her Majesty's offer and was appointed Prime Minister and First Lord of the Treasury..
24,1662467356.0,"['foreign', 'econom', 'brief', 'advis', 'nation', 'former', 'secur', 'domest', 'chief']","[[""econom"", 1.0]]",". Truss presented herself as the economic savior of a country heading into a winter of crisis. In the face of sky-high inflation and widespread economic misery, it’s a fantastical proposition.."
24,1662467737.0,"['evid', 'republican', 'outcom', 'claim', 'widespread', 'voter', 'proof', 'elect']","[[""factcheck"", 0.7830877195582628], [""farewel"", 0.6219112665622321]]","Boris Johnson speech factchecked: How do the former PM’s claims stack up?. In his farewell speech, Boris Johnson repeated claims about hospitals and nurses that we gave the C4 News FactCheck treatment throughout his time as prime minister.."
25,1662467908.0,"['money', 'tax']","[[""payer"", 1.0]]",Why didn’t Boris and Liz Truss travel to Balmoral ?? It would have saved the Tax payer a few quit if they did. Too many elites use the tax payer and state funds as their personal piggy bank....
25,1662468729.0,"['foreign', 'econom', 'brief', 'advis', 'nation', 'former', 'secur', 'domest', 'chief']","[[""photograph"", 0.6774951093383516], [""offer"", 0.542042807901893], [""secretari"", 0.4971820302710532]]",If this is from the Royal Photographer - fire the Royal Photographer…. Unless the brief was “make me look like I have no idea what’s going on”. Lovely photograph of the former PM arriving at Balmoral. She’s joined by Boris Johnson..
25,1662468772.0,"['counsel', 'attorney', 'said', 'investig', 'gener']","[[""offer"", 1.0]]","Former Tory leader Sir Iain Duncan Smith tells The World at One he has turned down offer to serve in Prime Minister Liz Truss's new Cabinet. ""I have been offered one and I have said that I won't be taking it up - I'll be going back to the backbenches again.""."
26,1662470138.0,"['troop', 'pay', 'cut', 'servic', 'order']","[[""100billion"", 0.5360298158734209], [""bailout"", 0.45569151611602926], [""month"", 0.4231959284591702], [""upward"", 0.4069981531306569], [""plaster"", 0.4003435875824618]]",Hang on. So have I got this right? Truss is going to borrow £100billion at a time when inflation is careering upwards and this is only going to plaster the problem for 4 months and energy companies don't have to pay the taxpayer back for the bailout?
26,1662470584.0,"['foreign', 'econom', 'brief', 'advis', 'nation', 'former', 'secur', 'domest', 'chief']","[[""plaster"", 0.46089289853238175], [""energi"", 0.45739810635121825], [""brief"", 0.45486307222290806], [""dismiss"", 0.3307330061106568], [""depend"", 0.29493447209453477], [""fullbrook"", 0.20718618625679217], [""fund"", 0.19937263860506826], [""subsidis"", 0.15733715520118893], [""circl"", 0.1542953402617804], [""inner"", 0.14948214829311451], [""bill"", 0.1466666965074067]]","As Churchill once said ‘we may allow ourselves a brief moment of rejoicing’. Mark Fullbrook named chief of staff as Truss selects inner circle right -wing think tank, history's greatest oxymoron."
27,1662478153.0,['*'],"[[""jenga"", 1.0]]",Very made of Jenga!!. UK Govt proudly brought to you by Jenga.. The Jenga premiership. Looks like a Jenga tower. It looks like jenga lmao. She’s clearly a massive Jenga fan. It’s all I can see.. Is Liz Truss about to play Jenga? ;D. Who’s for Jenga?.
28,1662479294.0,['*'],"[[""rain"", 1.0]]",Pls rain on truss pls rain on truss pls rain on truss. Love how they had to rush all the stuff inside because Liz Truss can't do a speech in the rain because witches melt in rain. Don’t rain on my parade but the rain will sink my premiership.
28,1662479358.0,"['work', 'want', 'countri', 'congratul', 'peac', 'get', 'need', 'mani']","[[""rain"", 0.6416989357647095], [""femal"", 0.6062115878258738], [""fun"", 0.4698190998927909]]","""State broadcaster scrambles to change its approach to news analysis content because the new PM can't tolerate being made fun of"" is a really proud headline for our stupid little country.. The rain is pissing down on Truss, just like all the ills and problems of the country."
28,1662479400.0,"['evid', 'republican', 'outcom', 'claim', 'widespread', 'voter', 'proof', 'elect']","[[""femal"", 0.766032307550514], [""fun"", 0.6428020720166004]]","FUN FACT: With Liz Truss as its new PM, England is now one of 4 countries to have had 3 female Prime Ministers. NOT FUN FACT: The United States is now one of only 6 countries to have NEVER had a female leader elected. We MUST address that."
28,1662479441.0,"['call', 'democrat', 'governor', 'pressur', 'leader']","[[""femal"", 0.7642912690733696], [""fun"", 0.6448711933543148]]","FUN FACT: With Liz Truss as its new PM, England is now one of 4 countries to have had 3 female Prime Ministers. NOT FUN FACT: The United States is now one of only 6 countries to have NEVER had a female leader elected. We MUST address that."
28,1662479548.0,"['attempt', 'democraci', 'power', 'tri', 'coup', 'cheat']","[[""rain"", 0.7872904688635889], [""handov"", 0.6165822878063807]]","The weather trying to tell liz truss something by raining that hard. The rain is god's tears at Boris Johnson's removal from power 🥺. It's raining Truss is stuck in traffic, surely the most British handover of power ever."
